{
  "definition_source": "MODEL_ACCEPTED",
  "domain_profile": {
    "anchors_en": [
      "contexts"
    ],
    "anchors_vi": [
      "ngữ cảnh",
      "ngữ cảnh tính toán",
      "thiết bị"
    ],
    "domain_id": "d2l_selected_campaign_scope_v1"
  },
  "effective_definition_en": "surrounding linguistic or situational settings in which something appears or is used",
  "effective_part_of_speech": "noun",
  "integrity": {
    "self_sha256": "d07e6a230ffe65e6caf8dd32a759f20f9da1a7f6574175587968033a1bbbd721"
  },
  "parent_dataset_manifest_sha256": "7b256808dacf446b06bc4f6cdc0ab8f0aa7585a2a4e3a56364cdb3508d17fbdc",
  "provenance": {
    "completed_at": "2026-07-29T17:00:00Z",
    "component_id": "d2l-dataset-effective-sense-projector",
    "component_version": "1.0.0",
    "execution_config_sha256": "cf027ff8d20c1d2ecd0c667ab303fc31f25a9eda80257b61329c34e67efcd05d",
    "model_routes": [],
    "notes": "Zero-network projection from Stage A evidence; no Stage B gold or final decision is assigned.",
    "policy_version": "d2l-dataset-50-senses-150-candidates-stage-b-v1.0",
    "prompt_hashes": {},
    "raw_ledger_ref": null,
    "run_id": "d2l-dataset-50-sense-contract-release",
    "run_spec_id": "d2l-dataset-50-sense-contract-spec-v1",
    "source_artifact_hashes": {
      "adjudication_manifest": "95482cd1b495b9014a1f00ba4695324f99f0637c6fb96f17d5ffded44c5e2b5c",
      "base_dataset_manifest": "92fab6032576a5c9c57fe38e23b6c622d5f73718a897197a2c10df35c7fe8b4d",
      "base_dataset_manifest_physical": "438dffc84aaa735e4f734d4dc5cefcf63dc8360743b6e941380bca71eec1f13a",
      "r0_result_manifest": "c17198864aeb47233fd658d7e6c333c5beb86c5531e5b240ca30e046d066a616",
      "review_binding": "da90ed6fac37b9bd2f3cc31afa58c9b966d6fdcb27889964a6cb31487496bae2",
      "review_intake_manifest": "bcb840616060473ea61b81ca7cf052eff2ac00caeb7bff75e7cbf064e6a7e178",
      "term_sense": "3c5bf307d28823bd489849abeee4291c58727fa166cde0daff03d681c7af80ee"
    },
    "started_at": "2026-07-29T17:00:00Z"
  },
  "review_artifact_sha256": "da90ed6fac37b9bd2f3cc31afa58c9b966d6fdcb27889964a6cb31487496bae2",
  "review_status": "ACCEPTED",
  "schema_id": "EffectiveSenseContractV1",
  "schema_version": "1.1.0",
  "scope_id": "d2l_selected_campaign_scope_v1",
  "scope_note": null,
  "sense_id": "d2lce_382e4bbab285d56a08249753",
  "sense_inventory_version": "d2l_dataset_50_senses_150_candidates_v1",
  "source_term": "contexts"
}
