{
  "definition_source": "MODEL_ACCEPTED",
  "domain_profile": {
    "anchors_en": [
      "learning rate"
    ],
    "anchors_vi": [
      "các tốc độ học",
      "hệ số học",
      "tốc độ học"
    ],
    "domain_id": "d2l_selected_campaign_scope_v1"
  },
  "effective_definition_en": "A training hyperparameter that controls the step size of parameter updates during optimization.",
  "effective_part_of_speech": "noun_phrase",
  "integrity": {
    "self_sha256": "b8a749e0aec0d258be245020d3d9ef6bce3759f37323cdddef50acb08f54a8d3"
  },
  "parent_dataset_manifest_sha256": "258ebe5d907a0a108a1b80a1ec1aad3c6e265ed1a8edbd5701cc128e273122ce",
  "provenance": {
    "completed_at": "2026-07-29T08:00:00Z",
    "component_id": "d2l-dataset-effective-sense-projector",
    "component_version": "1.0.0",
    "execution_config_sha256": "c0a8a26c215ffdd4a5c3586c500adfc4cb7b86691b47f0ba6990857f7bb43e61",
    "model_routes": [],
    "notes": "Zero-network Dataset projection from human-reviewed Stage A evidence.",
    "policy_version": "d2l-stage-a-p0b-official-11-sense-v1.0",
    "prompt_hashes": {},
    "raw_ledger_ref": null,
    "run_id": "d2l-stage-a-p0b-official-11-sense-release",
    "run_spec_id": "d2l-stage-a-p0b-official-11-sense-spec-v1",
    "source_artifact_hashes": {
      "dataset_manifest": "258ebe5d907a0a108a1b80a1ec1aad3c6e265ed1a8edbd5701cc128e273122ce",
      "review_binding": "4b504f224af0f68d0152c18be21ff2ba41a81187a3b7e57d8bb793a6b9719943",
      "reviewed_manifest": "e602af02edf1fb877a9541c5e37f939f4f35ded34ac878d773fc83b96ed3fb48",
      "term_sense": "18f27e7c043a00d9c7588b90f125eb8d5b88c1c404f30629a60edf3770bf0e3a"
    },
    "started_at": "2026-07-29T08:00:00Z"
  },
  "review_artifact_sha256": "4b504f224af0f68d0152c18be21ff2ba41a81187a3b7e57d8bb793a6b9719943",
  "review_status": "ACCEPTED",
  "schema_id": "EffectiveSenseContractV1",
  "schema_version": "1.1.0",
  "scope_id": "d2l_selected_campaign_scope_v1",
  "scope_note": null,
  "sense_id": "d2lce_cc4cb853eff638abcbdf7691",
  "sense_inventory_version": "d2l_context_support_set_validation_ready_v3",
  "source_term": "learning rate"
}
