{
  "definition_source": "MODEL_ACCEPTED",
  "domain_profile": {
    "anchors_en": [
      "null hypothesis"
    ],
    "anchors_vi": [
      "giả thuyết gốc",
      "giả thuyết không",
      "giả thuyết vô hiệu"
    ],
    "domain_id": "d2l_selected_campaign_scope_v1"
  },
  "effective_definition_en": "the default hypothesis in significance testing that is tested for possible rejection using observed data.",
  "effective_part_of_speech": "noun_phrase",
  "integrity": {
    "self_sha256": "397fc00ebb881e0bb96cdf0f25de7da8276647d2a2698b07f40061bfafd7b3e6"
  },
  "parent_dataset_manifest_sha256": "258ebe5d907a0a108a1b80a1ec1aad3c6e265ed1a8edbd5701cc128e273122ce",
  "provenance": {
    "completed_at": "2026-07-29T08:00:00Z",
    "component_id": "d2l-dataset-effective-sense-projector",
    "component_version": "1.0.0",
    "execution_config_sha256": "c0a8a26c215ffdd4a5c3586c500adfc4cb7b86691b47f0ba6990857f7bb43e61",
    "model_routes": [],
    "notes": "Zero-network Dataset projection from human-reviewed Stage A evidence.",
    "policy_version": "d2l-stage-a-p0b-official-11-sense-v1.0",
    "prompt_hashes": {},
    "raw_ledger_ref": null,
    "run_id": "d2l-stage-a-p0b-official-11-sense-release",
    "run_spec_id": "d2l-stage-a-p0b-official-11-sense-spec-v1",
    "source_artifact_hashes": {
      "dataset_manifest": "258ebe5d907a0a108a1b80a1ec1aad3c6e265ed1a8edbd5701cc128e273122ce",
      "review_binding": "65936af84e77fffd33aca38be6a70c0d7ed6a5d9274bad9a2c1616c18f74e141",
      "reviewed_manifest": "e602af02edf1fb877a9541c5e37f939f4f35ded34ac878d773fc83b96ed3fb48",
      "term_sense": "cfd8d59469c1c638ecf92ee17336551b78b8907febf5706b73ea785b3ea26439"
    },
    "started_at": "2026-07-29T08:00:00Z"
  },
  "review_artifact_sha256": "65936af84e77fffd33aca38be6a70c0d7ed6a5d9274bad9a2c1616c18f74e141",
  "review_status": "ACCEPTED",
  "schema_id": "EffectiveSenseContractV1",
  "schema_version": "1.1.0",
  "scope_id": "d2l_selected_campaign_scope_v1",
  "scope_note": null,
  "sense_id": "d2lce_11e1c294000ac67785408dcd",
  "sense_inventory_version": "d2l_context_support_set_validation_ready_v3",
  "source_term": "null hypothesis"
}
