{
  "definition_source": "MODEL_ACCEPTED",
  "domain_profile": {
    "anchors_en": [
      "Gradient Clipping"
    ],
    "anchors_vi": [
      "cắt gradient",
      "giới hạn gradient",
      "xén gradient"
    ],
    "domain_id": "d2l_selected_campaign_scope_v1"
  },
  "effective_definition_en": "A training technique that limits gradient size to prevent exploding gradients and improve stable convergence.",
  "effective_part_of_speech": "noun_phrase",
  "integrity": {
    "self_sha256": "2f1b27f23ba73d11fb32fce9da3c5bf278ad1b7d4b5384739ae38267dd9a2d73"
  },
  "parent_dataset_manifest_sha256": "7b256808dacf446b06bc4f6cdc0ab8f0aa7585a2a4e3a56364cdb3508d17fbdc",
  "provenance": {
    "completed_at": "2026-07-29T17:00:00Z",
    "component_id": "d2l-dataset-effective-sense-projector",
    "component_version": "1.0.0",
    "execution_config_sha256": "cf027ff8d20c1d2ecd0c667ab303fc31f25a9eda80257b61329c34e67efcd05d",
    "model_routes": [],
    "notes": "Zero-network projection from Stage A evidence; no Stage B gold or final decision is assigned.",
    "policy_version": "d2l-dataset-50-senses-150-candidates-stage-b-v1.0",
    "prompt_hashes": {},
    "raw_ledger_ref": null,
    "run_id": "d2l-dataset-50-sense-contract-release",
    "run_spec_id": "d2l-dataset-50-sense-contract-spec-v1",
    "source_artifact_hashes": {
      "adjudication_manifest": "95482cd1b495b9014a1f00ba4695324f99f0637c6fb96f17d5ffded44c5e2b5c",
      "base_dataset_manifest": "92fab6032576a5c9c57fe38e23b6c622d5f73718a897197a2c10df35c7fe8b4d",
      "base_dataset_manifest_physical": "438dffc84aaa735e4f734d4dc5cefcf63dc8360743b6e941380bca71eec1f13a",
      "r0_result_manifest": "c17198864aeb47233fd658d7e6c333c5beb86c5531e5b240ca30e046d066a616",
      "review_binding": "bb9ec889d3c3f5550b359dd65604688c052ab339b2336afdf416df0b1b0cc4a0",
      "review_intake_manifest": "bcb840616060473ea61b81ca7cf052eff2ac00caeb7bff75e7cbf064e6a7e178",
      "term_sense": "b810b483c8e2aaf9b9a91a3075c3d164f39d3399b471452718aa370a51cf1e9a"
    },
    "started_at": "2026-07-29T17:00:00Z"
  },
  "review_artifact_sha256": "bb9ec889d3c3f5550b359dd65604688c052ab339b2336afdf416df0b1b0cc4a0",
  "review_status": "ACCEPTED",
  "schema_id": "EffectiveSenseContractV1",
  "schema_version": "1.1.0",
  "scope_id": "d2l_selected_campaign_scope_v1",
  "scope_note": null,
  "sense_id": "d2lce_8d226b48ba7ec1493faa4ec8",
  "sense_inventory_version": "d2l_dataset_50_senses_150_candidates_v1",
  "source_term": "Gradient Clipping"
}
